{
  "profile": {
    "name": "Shivanshu Siyanwal",
    "title": "Quantum information and quantum machine learning",
    "tagline": "I build hybrid quantum-classical software — from variational algorithms and quantum ML to FPGA-accelerated inference and photonic network simulation.",
    "summary": "Quantum Software Engineer with 4+ years spanning quantum algorithm research and production software. I work across the full stack of quantum computing: variational algorithms (VQE/VQC/VQLS), quantum machine learning, quantum error correction, and photonic quantum networks — and I ship them as tested, deployable software on GPUs, FPGAs, and cloud quantum backends. Published in quantum ML, quantum cryptography, and NMR quantum simulation.",
    "location": "Uttar Pradesh, India",
    "email": "shivanshu.siyanwal@gmail.com",
    "phone": "",
    "availability": "Open to PhD / research-Master's positions and industry Quantum R&D roles.",
    "focus_areas": [
      "Quantum algorithms",
      "Quantum machine learning",
      "Hybrid quantum-classical systems",
      "Photonic quantum networks",
      "Quantum error correction"
    ],
    "links": {
      "cv_pdf": "assets/Shivanshu_Siyanwal_CV.pdf"
    },
    "profiles": [
      {
        "id": "scholar",
        "label": "Google Scholar",
        "handle": "Citations & papers",
        "url": "https://scholar.google.com/citations?user=REPLACE_ME",
        "primary": false,
        "audience": "academic"
      },
      {
        "id": "orcid",
        "label": "ORCID",
        "handle": "0009-0001-1023-1094",
        "url": "https://orcid.org/0009-0001-1023-1094",
        "primary": true,
        "audience": "academic"
      },
      {
        "id": "researchgate",
        "label": "ResearchGate",
        "handle": "Shivanshu-Siyanwal",
        "url": "https://www.researchgate.net/profile/REPLACE_ME",
        "primary": false,
        "audience": "academic"
      },
      {
        "id": "github",
        "label": "GitHub",
        "handle": "s-siyanwal",
        "url": "https://github.com/s-siyanwal",
        "primary": true,
        "audience": "industry"
      },
      {
        "id": "linkedin",
        "label": "LinkedIn",
        "handle": "shivanshu-s-796b69210",
        "url": "https://www.linkedin.com/in/shivanshu-s-796b69210/",
        "primary": true,
        "audience": "industry"
      },
      {
        "id": "email",
        "label": "Email",
        "handle": "shivanshu.siyanwal@gmail.com",
        "url": "mailto:shivanshu.siyanwal@gmail.com",
        "primary": true,
        "audience": "both"
      },
      {
        "id": "email-academic",
        "label": "Academic email",
        "handle": "shivanshuacademics@gmail.com",
        "url": "mailto:shivanshuacademics@gmail.com",
        "primary": true,
        "audience": "academic"
      }
    ]
  },
  "metrics": [
    {
      "value": "4+",
      "label": "Years in quantum",
      "note": "research + production"
    },
    {
      "value": "6.7×",
      "label": "FPGA speedup",
      "note": "vs GPU, 291.8 µs inference"
    },
    {
      "value": "56.5%",
      "label": "Forecast gain",
      "note": "VQC vs statistical baseline"
    },
    {
      "value": "5+",
      "label": "Publications",
      "note": "QML, QKD, NMR QC"
    }
  ],
  "skills": [
    {
      "category": "Quantum frameworks",
      "items": [
        "Qiskit",
        "Cirq",
        "PennyLane",
        "Perceval",
        "Amazon Braket",
        "CUDA-Q",
        "QTensorFlow"
      ]
    },
    {
      "category": "Quantum domains",
      "items": [
        "Quantum error correction",
        "Variational algorithms",
        "Linear-optical QC",
        "Quantum network simulation",
        "Tensor networks",
        "ZX calculus",
        "Circuit compilation"
      ]
    },
    {
      "category": "Software engineering",
      "items": [
        "Python (production)",
        "C++",
        "Git",
        "CI/CD pipelines",
        "Linux"
      ]
    },
    {
      "category": "Machine learning",
      "items": [
        "PyTorch",
        "TensorFlow",
        "NumPy",
        "SciPy",
        "Scikit-learn"
      ]
    },
    {
      "category": "Hardware & cloud",
      "items": [
        "AWS Braket",
        "AMD Alveo FPGA",
        "HLS",
        "HBM",
        "REST APIs"
      ]
    },
    {
      "category": "Simulation",
      "items": [
        "OptiSystem",
        "ANSYS",
        "QuTiP",
        "QETLAB"
      ]
    }
  ],
  "experience": [
    {
      "org": "Centre for Development of Advanced Computing (C-DAC)",
      "role": "Quantum Applications Engineer",
      "location": "Noida, India",
      "period": "Oct 2024 – Present",
      "current": true,
      "summary": "Hybrid quantum-classical pipelines and FPGA-accelerated quantum inference on cloud simulation infrastructure.",
      "points": [
        "Built hybrid quantum-classical pipelines for weather forecasting using a 7-qubit VQC (50 parameters), achieving 56.5% improvement over statistical baselines, deployed on cloud simulation infrastructure.",
        "Implemented and optimised VQE, QCNN, and fidelity-based kernels in Qiskit and PennyLane; built scalable modules for quantum image encoding (FRQI, QPIE, NEQR).",
        "Deployed a custom VQC kernel on an AMD Alveo U55C FPGA via HLS and HBM — 6.7× speedup over GPUs at 291.8 µs inference — integrated into CI/CD pipelines.",
        "Collaborated across hardware, research, and engineering teams to optimise hybrid workflows and support cloud quantum platforms."
      ],
      "tags": [
        "Qiskit",
        "PennyLane",
        "FPGA",
        "CI/CD"
      ]
    },
    {
      "org": "Institute for Advancing Intelligence, TCG CREST (PI: Dr. Arpita Maitra)",
      "role": "DRDO Junior Research Fellow — Quantum Networks and Linear Optics",
      "location": "Kolkata, India",
      "period": "Mar 2024 – Oct 2024",
      "summary": "Simulated linear-optical QKD testbeds with realistic photonic impairments and security analysis.",
      "points": [
        "Designed and simulated linear-optical QKD testbeds (DPS, COW, Twin-Field) in OptiSystem and ANSYS, modelling realistic photonic loss and noise.",
        "Performed error modelling and security analysis against intercept-resend and PNS attacks; benchmarked resource-state and entanglement generation.",
        "Built Python post-processing tools for optical simulation data — reusable, maintainable quantum-network simulation software."
      ],
      "tags": [
        "QKD",
        "Photonics",
        "OptiSystem",
        "DPS",
        "COW",
        "Twin-field QKD"
      ]
    },
    {
      "org": "Institute for Advancing Intelligence, TCG CREST (PI: Dr. Arpita Maitra)",
      "role": "Research Intern — Quantum Cryptography",
      "location": "Kolkata, India",
      "period": "Aug 2023 – Mar 2024",
      "summary": "Quantum circuits for block ciphers and a Grover-based plaintext–ciphertext attack.",
      "points": [
        "Designed quantum circuits for block ciphers (Mini-AES, S-AES) and Galois-field arithmetic; validated on Qiskit simulators and IBM Quantum hardware.",
        "Implemented a plaintext–ciphertext attack using Grover's search and amplitude amplification; contributed to error correction and circuit optimisation."
      ],
      "tags": [
        "Quantum cryptography",
        "Grover",
        "Qiskit"
      ]
    },
    {
      "org": "Arqanum Technologies Pvt. Ltd.",
      "role": "Quantum Computing Developer",
      "location": "Pune, India",
      "period": "Sep 2022 – Jul 2023",
      "summary": "Variational algorithms for finance and time-series on AWS Braket and Rigetti hardware.",
      "points": [
        "Implemented and optimised VQC, QBM, and VQLS for time-series forecasting and financial analysis on AWS Braket and Rigetti hardware.",
        "Developed quantum data-encoding techniques (amplitude, phase, angle) and Ising-Hamiltonian circuits.",
        "Contributed code to MeitY–QCAL (Dicke-state simulation) and to an Arqanum–IIT Kharagpur project on a quantum cryptographic hash."
      ],
      "tags": [
        "VQLS",
        "AWS Braket",
        "Finance"
      ]
    }
  ],
  "research": [
    {
      "org": "NMR Quantum Computing Group, IISER Mohali (PI: Prof. Kavita Dorai; co-supervisor: Prof. Arvind)",
      "role": "MS Research Student",
      "location": "Punjab, India",
      "period": "May 2021 – Aug 2022",
      "summary": "Neural networks for multipartite entanglement detection on a three-qubit NMR processor.",
      "points": [
        "Designed an ANN that detects genuine multipartite entanglement and assigns one of six SLOCC classes from a reduced set of density-matrix elements (canonical form; 128 elements reduced to 18, then ANOVA-ranked).",
        "Validated on 30 experimental three-qubit states from an NMR processor; GME detection remained accurate with 4 features and SLOCC classification with 6. Equal contribution with V. Gulati."
      ],
      "tags": [
        "QML",
        "NMR",
        "Entanglement"
      ]
    }
  ],
  "projects": [
    {
      "id": "vqc-fpga",
      "name": "Hybrid VQC Weather Forecasting with FPGA Inference",
      "blurb": "7-qubit variational circuit for temperature forecasting, with a custom kernel on an AMD Alveo FPGA for low-latency inference.",
      "abstract": "A hybrid quantum-classical pipeline that forecasts temperature using a 7-qubit variational quantum circuit (50 parameters). The trained inference kernel is compiled to an AMD Alveo U55C FPGA using HLS with HBM memory, reaching 291.8 µs inference — a 6.7× speedup over GPU execution — and is wired into CI/CD for continuous testing.",
      "metrics": [
        {
          "value": "6.7×",
          "label": "vs GPU"
        },
        {
          "value": "291.8 µs",
          "label": "inference"
        },
        {
          "value": "7",
          "label": "qubits"
        }
      ],